{
  "schemaVersion": 1,
  "id": "P10",
  "ruleId": "NSG003",
  "description": "Client render reads `document` without a guard.",
  "projectVariant": ".",
  "preconditions": {
    "nextVersion": "16.3.8",
    "reactVersion": "19.3.0",
    "reactDomVersion": "19.3.0",
    "typescriptVersion": "6.0.3",
    "contexts": [
      "client-ssr"
    ]
  },
  "expectedStatus": "finding",
  "expectedFindings": [
    {
      "ruleId": "NSG003",
      "severity": "high",
      "confidence": "high",
      "location": {
        "file": "app/page.tsx",
        "start": {
          "line": 2,
          "column": 45,
          "offset": 58
        },
        "end": {
          "line": 2,
          "column": 53,
          "offset": 66
        }
      },
      "symbol": "Page",
      "traceSymbols": [
        "global#document"
      ]
    }
  ],
  "expectedLimits": [],
  "correctedCase": "corrected"
}
