{
  "schemaVersion": 1,
  "id": "U01",
  "ruleId": null,
  "description": "An import with a nonconstant computed expression.",
  "projectVariant": ".",
  "preconditions": {
    "nextVersion": "16.3.8",
    "reactVersion": "19.3.0",
    "reactDomVersion": "19.3.0",
    "typescriptVersion": "6.0.3",
    "contexts": [
      "rsc"
    ]
  },
  "expectedStatus": "partial",
  "expectedFindings": [],
  "expectedLimits": [
    {
      "code": "unresolved-import",
      "location": {
        "file": "app/page.tsx",
        "start": {
          "line": 1,
          "column": 52,
          "offset": 51
        },
        "end": {
          "line": 1,
          "column": 64,
          "offset": 63
        }
      },
      "affectedRules": [
        "NSG001",
        "NSG002",
        "NSG003",
        "NSG004",
        "NSG005",
        "NSG006"
      ]
    }
  ],
  "correctedCase": null
}
