{
  "schemaVersion": 1,
  "id": "N18",
  "ruleId": "NSG005",
  "description": "A literal DTO excludes the secret field before being sent to the client.",
  "projectVariant": ".",
  "preconditions": {
    "nextVersion": "16.3.8",
    "reactVersion": "19.3.0",
    "reactDomVersion": "19.3.0",
    "typescriptVersion": "6.0.3",
    "contexts": [
      "rsc"
    ]
  },
  "expectedStatus": "clean",
  "expectedFindings": [],
  "expectedLimits": [],
  "correctedCase": null
}
