{
  "schemaVersion": 1,
  "id": "P21",
  "ruleId": "NSG006",
  "description": "Correction (javascript)",
  "projectVariant": ".",
  "preconditions": {
    "nextVersion": "16.3.8",
    "reactVersion": "19.3.0",
    "reactDomVersion": "19.3.0",
    "typescriptVersion": "6.0.3",
    "contexts": [
      "rsc"
    ]
  },
  "expectedStatus": "clean",
  "expectedFindings": [],
  "expectedLimits": [],
  "correctedCase": null
}
