{
  "schemaVersion": 1,
  "id": "P05",
  "ruleId": "NSG002",
  "description": "Server Component calls `useState`.",
  "projectVariant": ".",
  "preconditions": {
    "nextVersion": "16.3.8",
    "reactVersion": "19.3.0",
    "reactDomVersion": "19.3.0",
    "typescriptVersion": "6.0.3",
    "contexts": [
      "client-ssr"
    ]
  },
  "expectedStatus": "clean",
  "expectedFindings": [],
  "expectedLimits": [],
  "correctedCase": null
}
