{
  "schemaVersion": 1,
  "id": "P14",
  "ruleId": "NSG004",
  "description": "Server sends a custom class instance inside an object.",
  "projectVariant": ".",
  "preconditions": {
    "nextVersion": "16.3.8",
    "reactVersion": "19.3.0",
    "reactDomVersion": "19.3.0",
    "typescriptVersion": "6.0.3",
    "contexts": [
      "rsc"
    ]
  },
  "expectedStatus": "finding",
  "expectedFindings": [
    {
      "ruleId": "NSG004",
      "severity": "high",
      "confidence": "high",
      "location": {
        "file": "app/page.tsx",
        "start": {
          "line": 3,
          "column": 55,
          "offset": 112
        },
        "end": {
          "line": 3,
          "column": 78,
          "offset": 135
        }
      },
      "symbol": "Page",
      "traceSymbols": [
        "app/client.tsx#default.data"
      ]
    }
  ],
  "expectedLimits": [],
  "correctedCase": "corrected"
}
