{
  "schemaVersion": 1,
  "id": "P13",
  "ruleId": "NSG004",
  "description": "Server sends an ordinary handler to a client prop. (javascript)",
  "projectVariant": ".",
  "preconditions": {
    "nextVersion": "16.3.8",
    "reactVersion": "19.3.0",
    "reactDomVersion": "19.3.0",
    "typescriptVersion": "6.0.3",
    "contexts": [
      "rsc"
    ]
  },
  "expectedStatus": "finding",
  "expectedFindings": [
    {
      "ruleId": "NSG004",
      "severity": "high",
      "confidence": "high",
      "location": {
        "file": "app/page.jsx",
        "start": {
          "line": 2,
          "column": 58,
          "offset": 88
        },
        "end": {
          "line": 2,
          "column": 65,
          "offset": 95
        }
      },
      "symbol": "Page",
      "traceSymbols": [
        "app/client.jsx#default.handler"
      ]
    }
  ],
  "expectedLimits": [],
  "correctedCase": "corrected"
}
