{
  "schemaVersion": 1,
  "id": "N01",
  "ruleId": "NSG001",
  "description": "Client imports only types from a server module.",
  "projectVariant": ".",
  "preconditions": {
    "nextVersion": "16.3.8",
    "reactVersion": "19.3.0",
    "reactDomVersion": "19.3.0",
    "typescriptVersion": "6.0.3",
    "contexts": [
      "client-ssr"
    ]
  },
  "expectedStatus": "clean",
  "expectedFindings": [],
  "expectedLimits": [],
  "correctedCase": null
}
